{
  "schema_version": 1,
  "id": "synthetic-breakout-metrics-v0",
  "run_receipt": "run_receipt.json",
  "created_at": "2026-07-09T00:00:00Z",
  "sample": {
    "start_time": "2026-01-01T00:00:00Z",
    "end_time": "2026-01-31T00:00:00Z",
    "evaluation_scope": "diagnostic",
    "trades": 0,
    "signals": 3,
    "instruments": ["SYNTH"]
  },
  "gross_metrics": {
    "pnl": null,
    "sharpe": null,
    "max_drawdown": null,
    "win_rate": null,
    "turnover": null
  },
  "net_metrics": {
    "pnl": null,
    "sharpe": null,
    "max_drawdown": null,
    "win_rate": null,
    "turnover": null
  },
  "robustness": {
    "null_baseline_result": "not applicable; fixture only",
    "dsr_or_psr": null,
    "pbo": null,
    "stress_results": [],
    "parameter_stability": "not applicable"
  },
  "limitations": ["No real returns", "No execution evidence"]
}
